{"schemaVersion":1,"generatedAt":"2026-10-26T12:59:09.161Z","sources":[{"id":"mochiii-curated","name":"Reviewed by Mochiii","url":"https://www.mochiii.in/mcp"},{"id":"mcp-registry","name":"Official MCP Registry","url":"https://registry.modelcontextprotocol.io"}],"community":{"path":"community.json","count":16537},"servers":[
{"id":"filesystem","name":"Filesystem","description":"Read, write, move and search files in the open project, from the MCP reference servers. Reaches only the project folder it starts in.","publisher":"Model Context Protocol","tier":"verified","categories":["developer-tools"],"homepage":"https://github.com/modelcontextprotocol/servers/tree/main/src/filesystem","package":{"registry":"npm","identifier":"@modelcontextprotocol/server-filesystem","version":"1.0.0","url":"https://www.npmjs.com/package/@modelcontextprotocol/server-filesystem/v/1.0.0"},"launch":{"command":"npx","args":["-y","@modelcontextprotocol/server-filesystem@1.0.0","."]},"env":[],"cwd":"workspace"},
{"id":"git","name":"Git","description":"Status, diff, log, branches and commits in the project's Git repository, from the MCP reference servers.","publisher":"Model Context Protocol","tier":"verified","categories":["developer-tools"],"homepage":"https://github.com/modelcontextprotocol/servers/tree/main/src/git","package":{"registry":"pypi","identifier":"mcp-server-git","version":"2026.10.19","url":"https://pypi.org/project/mcp-server-git/2026.10.19/"},"launch":{"command":"uvx","args":["mcp-server-git@2026.10.19","--repository","."]},"env":[],"cwd":"workspace"},
{"id":"github","name":"GitHub","description":"GitHub's official server: repositories, issues, pull requests, code search and Actions, through your own token.","publisher":"GitHub","namespace":"io.github.github/github-mcp-server","tier":"verified","categories":["developer-tools"],"homepage":"https://github.com/github/github-mcp-server","package":{"registry":"oci","identifier":"ghcr.io/github/github-mcp-server@sha256:250bc6ce70788207608ef74cef4397230ff2e8481218da74d6093e4bd9101132","version":"2.0.3"},"launch":{"command":"docker","args":["run","-i","--rm","-e","GITHUB_PERSONAL_ACCESS_TOKEN","ghcr.io/github/github-mcp-server@sha256:250bc6ce70788207608ef74cef4397230ff2e8481218da74d6093e4bd9101132"]},"env":[{"name":"GITHUB_PERSONAL_ACCESS_TOKEN","required":true,"secret":true,"description":"A GitHub personal access token. Scope it to what you want Mochiii to reach."}]},
{"id":"postgres","name":"PostgreSQL","description":"Run SQL against a PostgreSQL database and inspect its schema, tables and indexes. Google's MCP Toolbox for Databases, with its prebuilt PostgreSQL tools.","publisher":"Google","namespace":"io.github.googleapis/mcp-toolbox","tier":"verified","categories":["data"],"homepage":"https://github.com/googleapis/mcp-toolbox","package":{"registry":"npm","identifier":"@toolbox-sdk/server","version":"1.15.0","url":"https://www.npmjs.com/package/@toolbox-sdk/server/v/1.15.0"},"launch":{"command":"npx","args":["-y","@toolbox-sdk/server@1.15.0","--prebuilt","postgres","--stdio"]},"env":[{"name":"POSTGRES_HOST","required":true,"secret":false,"description":"The database host, e.g. localhost."},{"name":"POSTGRES_PORT","required":true,"secret":false,"description":"The database port, usually 5432."},{"name":"POSTGRES_DATABASE","required":true,"secret":false,"description":"The database to connect to."},{"name":"POSTGRES_USER","required":true,"secret":false,"description":"The user to connect as. A read-only role is the safe choice."},{"name":"POSTGRES_PASSWORD","required":true,"secret":true,"description":"That user's password."}]},
{"id":"sqlite","name":"SQLite","description":"Query a SQLite database file and inspect its tables. Google's MCP Toolbox for Databases, with its prebuilt SQLite tools, started in the project.","publisher":"Google","namespace":"io.github.googleapis/mcp-toolbox","tier":"verified","categories":["data"],"homepage":"https://github.com/googleapis/mcp-toolbox","package":{"registry":"npm","identifier":"@toolbox-sdk/server","version":"1.15.0","url":"https://www.npmjs.com/package/@toolbox-sdk/server/v/1.15.0"},"launch":{"command":"npx","args":["-y","@toolbox-sdk/server@1.15.0","--prebuilt","sqlite","--stdio"]},"env":[{"name":"SQLITE_DATABASE","required":true,"secret":false,"description":"Path to the database file, relative to the project or absolute."}],"cwd":"workspace"},
{"id":"playwright","name":"Playwright","description":"Drive a real browser with Playwright: navigate, click, fill forms and read pages through the accessibility tree.","publisher":"Microsoft","namespace":"io.github.microsoft/playwright-mcp","tier":"verified","categories":["browser","developer-tools"],"homepage":"https://github.com/microsoft/playwright-mcp","package":{"registry":"npm","identifier":"@playwright/mcp","version":"0.0.82","url":"https://www.npmjs.com/package/@playwright/mcp/v/0.0.82"},"launch":{"command":"npx","args":["-y","@playwright/mcp@0.0.82"]},"env":[]},
{"id":"chrome-devtools","name":"Chrome DevTools","description":"Inspect and debug a live Chrome: network requests, console, performance traces and DOM, from the Chrome DevTools team.","publisher":"Google Chrome DevTools","namespace":"io.github.ChromeDevTools/chrome-devtools-mcp","tier":"verified","categories":["browser","developer-tools"],"homepage":"https://github.com/ChromeDevTools/chrome-devtools-mcp","package":{"registry":"npm","identifier":"chrome-devtools-mcp","version":"1.12.0","url":"https://www.npmjs.com/package/chrome-devtools-mcp/v/1.12.0"},"launch":{"command":"npx","args":["-y","chrome-devtools-mcp@1.12.0","--headless","--no-usage-statistics"]},"env":[]},
{"id":"fetch","name":"Fetch","description":"Fetch a web page or API response and hand it to the model as Markdown, from the MCP reference servers. It can reach any URL your machine can, local ones included.","publisher":"Model Context Protocol","tier":"verified","categories":["docs","developer-tools"],"homepage":"https://github.com/modelcontextprotocol/servers/tree/main/src/fetch","package":{"registry":"pypi","identifier":"mcp-server-fetch","version":"2026.10.24","url":"https://pypi.org/project/mcp-server-fetch/2026.10.24/"},"launch":{"command":"uvx","args":["mcp-server-fetch@2026.10.24"]},"env":[]},
{"id":"context7","name":"Context7","description":"Up-to-date, version-specific documentation and code examples for libraries, pulled into the model's context on request.","publisher":"Upstash","namespace":"io.github.upstash/context7","tier":"verified","categories":["docs","developer-tools"],"homepage":"https://context7.com","package":{"registry":"npm","identifier":"@upstash/context7-mcp","version":"4.4.4","url":"https://www.npmjs.com/package/@upstash/context7-mcp/v/4.4.4"},"launch":{"command":"npx","args":["-y","@upstash/context7-mcp@4.4.4"]},"env":[{"name":"CONTEXT7_API_KEY","required":false,"secret":true,"description":"A Context7 API key, for higher rate limits. It works without one."}]},
{"id":"eslint","name":"ESLint","description":"Lint files in the project with its own ESLint configuration and explain the problems found. The ESLint team's official server.","publisher":"ESLint","tier":"verified","categories":["developer-tools"],"homepage":"https://eslint.org/docs/latest/use/mcp","package":{"registry":"npm","identifier":"@eslint/mcp","version":"0.3.15","url":"https://www.npmjs.com/package/@eslint/mcp/v/0.3.15"},"launch":{"command":"npx","args":["-y","@eslint/mcp@0.3.15"]},"env":[],"cwd":"workspace"},
{"id":"next-devtools","name":"Next.js DevTools","description":"Next.js documentation, upgrade guides and a running dev server's errors and routes, from the Next.js team.","publisher":"Vercel","namespace":"io.github.vercel/next-devtools-mcp","tier":"verified","categories":["developer-tools","docs"],"homepage":"https://github.com/vercel/next-devtools-mcp","package":{"registry":"npm","identifier":"next-devtools-mcp","version":"0.3.6","url":"https://www.npmjs.com/package/next-devtools-mcp/v/0.3.6"},"launch":{"command":"npx","args":["-y","next-devtools-mcp@0.3.6"]},"env":[],"cwd":"workspace"},
{"id":"nx","name":"Nx","description":"Understand an Nx monorepo: its projects, their dependencies, targets and generators, and the Nx docs. From the Nx team.","publisher":"Nx","namespace":"io.github.nrwl/nx-mcp","tier":"verified","categories":["developer-tools"],"homepage":"https://github.com/nrwl/nx-console","package":{"registry":"npm","identifier":"nx-mcp","version":"0.25.0","url":"https://www.npmjs.com/package/nx-mcp/v/0.25.0"},"launch":{"command":"npx","args":["-y","nx-mcp@0.25.0","."]},"env":[],"cwd":"workspace"},
{"id":"mongodb","name":"MongoDB","description":"Query and manage a MongoDB database: collections, documents, indexes and aggregations. MongoDB's official server.","publisher":"MongoDB","namespace":"io.github.mongodb-js/mongodb-mcp-server","tier":"verified","categories":["data"],"homepage":"https://github.com/mongodb-js/mongodb-mcp-server","package":{"registry":"npm","identifier":"mongodb-mcp-server","version":"2.1.0","url":"https://www.npmjs.com/package/mongodb-mcp-server/v/2.1.0"},"launch":{"command":"npx","args":["-y","mongodb-mcp-server@2.1.0"]},"env":[{"name":"MDB_MCP_CONNECTION_STRING","required":false,"secret":true,"description":"The connection string of the database to work with. Without it, the model has to be given one with the connect tool."},{"name":"MDB_MCP_READ_ONLY","required":false,"secret":false,"description":"Set to true to allow only reads."}]},